{
  "$schema": "https://json-schema.org/draft/2020-12/schema",
  "$id": "https://contracts.ratemyrepresentatives.app/v1/representation-resolution.schema.json",
  "title": "RepresentationResolution",
  "type": "object",
  "additionalProperties": false,
  "required": [
    "schemaVersion",
    "resolutionId",
    "dataMode",
    "countryCode",
    "asOf",
    "state",
    "detailCode",
    "matches",
    "ambiguity",
    "provider",
    "inputDisposition",
    "legalDeterminations"
  ],
  "properties": {
    "schemaVersion": { "const": "representation-resolution.v1" },
    "resolutionId": { "$ref": "#/$defs/opaqueId" },
    "dataMode": { "const": "synthetic" },
    "countryCode": { "enum": ["CA", "US"] },
    "asOf": { "type": "string", "format": "date-time" },
    "state": {
      "enum": [
        "resolved",
        "ambiguous",
        "unsupported",
        "conflicting",
        "stale",
        "provider_unavailable"
      ]
    },
    "detailCode": {
      "oneOf": [{ "type": "string", "pattern": "^[A-Z][A-Z0-9_]{2,63}$" }, { "type": "null" }]
    },
    "matches": { "type": "array", "items": { "$ref": "#/$defs/match" } },
    "ambiguity": {
      "oneOf": [
        {
          "type": "object",
          "additionalProperties": false,
          "required": ["selectionToken", "expiresAt", "options"],
          "properties": {
            "selectionToken": { "$ref": "#/$defs/opaqueId" },
            "expiresAt": { "type": "string", "format": "date-time" },
            "options": {
              "type": "array",
              "minItems": 2,
              "items": {
                "type": "object",
                "additionalProperties": false,
                "required": ["candidateId", "label"],
                "properties": {
                  "candidateId": { "$ref": "#/$defs/opaqueId" },
                  "label": { "type": "string", "minLength": 1, "maxLength": 160 }
                }
              }
            }
          }
        },
        { "type": "null" }
      ]
    },
    "provider": { "$ref": "#/$defs/metadata" },
    "inputDisposition": {
      "type": "object",
      "additionalProperties": false,
      "required": ["disposedAt", "logged", "persisted", "queued", "sentToAi", "sentToVerus"],
      "properties": {
        "disposedAt": { "type": "string", "format": "date-time" },
        "logged": { "const": false },
        "persisted": { "const": false },
        "queued": { "const": false },
        "sentToAi": { "const": false },
        "sentToVerus": { "const": false }
      }
    },
    "legalDeterminations": {
      "type": "object",
      "additionalProperties": false,
      "required": ["citizenship", "legalResidence", "voterEligibility"],
      "properties": {
        "citizenship": { "const": "not_determined" },
        "legalResidence": { "const": "not_determined" },
        "voterEligibility": { "const": "not_determined" }
      }
    }
  },
  "$defs": {
    "opaqueId": {
      "type": "string",
      "pattern": "^[a-zA-Z0-9][a-zA-Z0-9._:-]{0,127}$"
    },
    "identifier": {
      "type": "object",
      "additionalProperties": false,
      "required": ["issuer", "identifier"],
      "properties": {
        "issuer": { "type": "string", "minLength": 1, "maxLength": 128 },
        "identifier": { "type": "string", "minLength": 1, "maxLength": 128 }
      }
    },
    "entity": {
      "type": "object",
      "additionalProperties": false,
      "required": ["applicationId", "authoritativeIdentifiers", "label"],
      "properties": {
        "applicationId": { "$ref": "#/$defs/opaqueId" },
        "authoritativeIdentifiers": {
          "type": "array",
          "minItems": 1,
          "items": { "$ref": "#/$defs/identifier" }
        },
        "label": { "type": "string", "minLength": 1, "maxLength": 160 }
      }
    },
    "match": {
      "type": "object",
      "additionalProperties": false,
      "required": [
        "scope",
        "matchState",
        "jurisdiction",
        "district",
        "officeId",
        "officeTermId",
        "candidacyIds"
      ],
      "properties": {
        "scope": { "enum": ["local", "regional", "province_state", "federal", "special"] },
        "matchState": { "enum": ["matched", "coverage_gap"] },
        "jurisdiction": { "$ref": "#/$defs/entity" },
        "district": { "oneOf": [{ "$ref": "#/$defs/entity" }, { "type": "null" }] },
        "officeId": { "oneOf": [{ "$ref": "#/$defs/opaqueId" }, { "type": "null" }] },
        "officeTermId": {
          "oneOf": [{ "$ref": "#/$defs/opaqueId" }, { "type": "null" }]
        },
        "candidacyIds": { "type": "array", "items": { "$ref": "#/$defs/opaqueId" } }
      }
    },
    "metadata": {
      "type": "object",
      "additionalProperties": false,
      "required": ["geometry", "source"],
      "properties": {
        "geometry": {
          "type": "object",
          "additionalProperties": false,
          "required": ["effectiveFrom", "license", "sha256", "version"],
          "properties": {
            "effectiveFrom": { "type": "string", "format": "date-time" },
            "license": { "type": "string", "minLength": 1, "maxLength": 256 },
            "sha256": { "type": "string", "pattern": "^[a-f0-9]{64}$" },
            "version": { "type": "string", "minLength": 1, "maxLength": 128 }
          }
        },
        "source": {
          "type": "object",
          "additionalProperties": false,
          "required": ["license", "observedAt", "providerId", "retention", "termsUrl", "version"],
          "properties": {
            "license": { "type": "string", "minLength": 1, "maxLength": 256 },
            "observedAt": { "type": "string", "format": "date-time" },
            "providerId": { "$ref": "#/$defs/opaqueId" },
            "retention": { "const": "none" },
            "termsUrl": {
              "oneOf": [
                { "type": "string", "format": "uri", "pattern": "^https://" },
                { "type": "null" }
              ]
            },
            "version": { "type": "string", "minLength": 1, "maxLength": 128 }
          }
        }
      }
    }
  }
}
